{
  "course_name": "课程名称（如：计算机网络 / 操作系统）",
  "lab_name": "实验名称（如：实验一 经典网络协议分析）",
  "instruments": "微型计算机（Windows 11 / Linux）、相关专业实验平台与仿真调试软件。",
  "student_info": {
    "university": "四川轻化工大学",
    "department": "计算机科学与工程学院",
    "major": "计算机类专业",
    "class_num": "2024级",
    "name": "同学姓名",
    "student_id": "学号未填写",
    "group_num": "01",
    "lab_name": "专业教学实验室",
    "date": "2026年秋季"
  },
  "purposes": [
    {
      "title": "实验目的 1",
      "desc": "掌握核心原理与专业实验工具的基本操作。"
    },
    {
      "title": "实验目的 2",
      "desc": "通过上机仿真与动手实践，加深对核心机制与算法的理解。"
    }
  ],
  "principles": [
    {
      "title": "核心原理概述",
      "summary": "本实验涉及的基础理论与系统体系结构。",
      "items": [
        {
          "prefix": "• 关键机理一：",
          "text": "详细原理解析说明。"
        },
        {
          "prefix": "• 关键机理二：",
          "text": "算法流转或协议报文交互过程。"
        }
      ]
    }
  ],
  "process_part1": {
    "main_title": "一、 实验环境部署与任务一实测",
    "sections": [
      {
        "title": "1. 拓扑环境搭建与基础参数配置",
        "paragraphs": [
          "按照指导书要求完成环境搭建与验证..."
        ]
      }
    ]
  },
  "process_part2": {
    "main_title": "二、 核心实验内容深入分析与数据解剖",
    "sections": [
      {
        "title": "1. 关键指标实测与对比解剖",
        "paragraphs": [
          "测试执行过程、报文结构捕获与深入机理剖析..."
        ]
      }
    ]
  },
  "raw_records": [
    {
      "title": "【原始记录一】核心配置脚本或核心代码实现",
      "type": "code",
      "code_lines": [
        "// 核心代码或配置脚本示例",
        "int main() {",
        "    printf(\"Hello, Lab Report!\\n\");",
        "    return 0;",
        "}"
      ]
    }
  ],
  "questions": [
    {
      "question": "课后思考题 1：请分析关键技术机理及工程设计考量",
      "intro": "思考题解题思路与理论背景：",
      "answers": [
        {
          "prefix": "• 核心技术论证：",
          "text": "结合实验现象进行深度推导与论述。"
        }
      ]
    }
  ],
  "summary": "本次实验将理论与工程实践深度融合，全面掌握了核心知识体系，建立了严谨的工程思维与实证方法。"
}
